{
  "family": "ffmpeg",
  "version": "v1",
  "artifact_id": "ffmpeg-curated-source-v1",
  "generated_from": {
    "kind": "legacy_seed_script",
    "path": "tools/scripts/seed_ffmpeg_errors_recipes.py"
  },
  "entries": [
    {
      "entry_id": "ffmpeg-error-ffmpeg-error-moov-atom-not-found",
      "kind": "error",
      "title": "ffmpeg error: moov atom not found",
      "statement": "MP4/MOV file is truncated or being written \u2014 the index ('moov atom') hasn't been written yet, or download/upload was cut off. Fix: (1) for downloads in progress, wait until complete; (2) recover with `untrunc <reference.mp4> <broken.mp4>` (open-source recovery tool); (3) try `ffmpeg -err_detect ignore_err -i broken.mp4 -c copy out.mp4` (sometimes recoverable); (4) for live recording, use `-movflags +faststart+frag_keyframe` so the moov is written incrementally.",
      "source_url": "https://ffmpeg.org/ffmpeg-formats.html",
      "source_type": "official_docs",
      "commands": [
        "untrunc <reference.mp4> <broken.mp4>",
        "ffmpeg -err_detect ignore_err -i broken.mp4 -c copy out.mp4",
        "-movflags +faststart+frag_keyframe"
      ],
      "steps": [
        "for downloads in progress, wait until complete",
        "recover with `untrunc <reference.mp4> <broken.mp4>` (open-source recovery tool)",
        "try `ffmpeg -err_detect ignore_err -i broken.mp4 -c copy out.mp4` (sometimes recoverable)",
        "for live recording, use `-movflags +faststart+frag_keyframe` so the moov is written incrementally"
      ],
      "constraints": [
        "Requires binaries or commands referenced in examples: -movflags, ffmpeg, untrunc."
      ],
      "effect": {
        "kind": "filesystem",
        "destructive": false,
        "reversible": true,
        "mutates_remote_state": false,
        "may_cost_money": false,
        "may_expose_secrets": false,
        "risk_level": "medium",
        "reasons": [
          "No explicit risk rule matched; require confirmation until the action is classified."
        ]
      },
      "provenance": {
        "source_artifact_id": "ffmpeg-curated-source-v1",
        "migration_method": "legacy_seed_projection_v1",
        "legacy_seed_script": "tools/scripts/seed_ffmpeg_errors_recipes.py",
        "legacy_tool_id": "ffmpeg-errors",
        "legacy_title": "ffmpeg error: moov atom not found"
      },
      "confidence": 0.9
    },
    {
      "entry_id": "ffmpeg-error-ffmpeg-error-invalid-data-found-when-processing-input",
      "kind": "error",
      "title": "ffmpeg error: Invalid data found when processing input",
      "statement": "Input file is corrupted, in an unrecognized format, or has a wrong extension. Fix: (1) confirm what it actually is: `ffprobe input.xyz` or `file input.xyz`; (2) force a format: `ffmpeg -f mpegts -i input.xyz out.mp4`; (3) for raw streams: `ffmpeg -f rawvideo -pix_fmt yuv420p -s 1920x1080 -i raw.yuv out.mp4`; (4) ignore decode errors: `-err_detect ignore_err`; (5) for partial recovery: `-fflags +discardcorrupt`.",
      "source_url": "https://ffmpeg.org/ffmpeg.html",
      "source_type": "official_docs",
      "commands": [
        "ffprobe input.xyz",
        "file input.xyz",
        "ffmpeg -f mpegts -i input.xyz out.mp4",
        "ffmpeg -f rawvideo -pix_fmt yuv420p -s 1920x1080 -i raw.yuv out.mp4",
        "-err_detect ignore_err",
        "-fflags +discardcorrupt"
      ],
      "steps": [
        "confirm what it actually is: `ffprobe input.xyz` or `file input.xyz`",
        "force a format: `ffmpeg -f mpegts -i input.xyz out.mp4`",
        "for raw streams: `ffmpeg -f rawvideo -pix_fmt yuv420p -s 1920x1080 -i raw.yuv out.mp4`",
        "ignore decode errors: `-err_detect ignore_err`",
        "for partial recovery: `-fflags +discardcorrupt`"
      ],
      "constraints": [
        "Requires binaries or commands referenced in examples: -err_detect, -fflags, ffmpeg, ffprobe, file."
      ],
      "effect": {
        "kind": "filesystem",
        "destructive": false,
        "reversible": true,
        "mutates_remote_state": false,
        "may_cost_money": false,
        "may_expose_secrets": false,
        "risk_level": "medium",
        "reasons": [
          "No explicit risk rule matched; require confirmation until the action is classified."
        ]
      },
      "provenance": {
        "source_artifact_id": "ffmpeg-curated-source-v1",
        "migration_method": "legacy_seed_projection_v1",
        "legacy_seed_script": "tools/scripts/seed_ffmpeg_errors_recipes.py",
        "legacy_tool_id": "ffmpeg-errors",
        "legacy_title": "ffmpeg error: Invalid data found when processing input"
      },
      "confidence": 0.9
    },
    {
      "entry_id": "ffmpeg-error-ffmpeg-error-stream-specifier-x-in-filtergraph-matches-no-streams",
      "kind": "error",
      "title": "ffmpeg error: Stream specifier 'X' in filtergraph matches no streams",
      "statement": "Your `-map` or filter references a stream index that doesn't exist (e.g. -map 0:1 when there's only 0:0). Fix: (1) list streams first: `ffprobe input.mp4` \u2014 note the [0:0], [0:1] indices; (2) use stream type instead of index: `-map 0:v:0` (first video), `-map 0:a:0` (first audio); (3) optional map (skip silently if missing): `-map 0:s?` (the ? makes it optional); (4) for filter_complex, label outputs: `[0:v]scale=...[vout]` then `-map '[vout]'`.",
      "source_url": "https://ffmpeg.org/ffmpeg.html",
      "source_type": "official_docs",
      "commands": [
        "-map",
        "ffprobe input.mp4",
        "-map 0:v:0",
        "-map 0:a:0",
        "-map 0:s?",
        "-map '[vout]'"
      ],
      "steps": [
        "list streams first: `ffprobe input.mp4` \u2014 note the [0:0], [0:1] indices",
        "use stream type instead of index: `-map 0:v:0` (first video), `-map 0:a:0` (first audio)",
        "optional map (skip silently if missing): `-map 0:s?` (the ? makes it optional)",
        "for filter_complex, label outputs: `[0:v]scale=...[vout]` then `-map '[vout]'`"
      ],
      "constraints": [
        "Requires binaries or commands referenced in examples: -map, ffprobe."
      ],
      "effect": {
        "kind": "filesystem",
        "destructive": false,
        "reversible": true,
        "mutates_remote_state": false,
        "may_cost_money": false,
        "may_expose_secrets": false,
        "risk_level": "medium",
        "reasons": [
          "No explicit risk rule matched; require confirmation until the action is classified."
        ]
      },
      "provenance": {
        "source_artifact_id": "ffmpeg-curated-source-v1",
        "migration_method": "legacy_seed_projection_v1",
        "legacy_seed_script": "tools/scripts/seed_ffmpeg_errors_recipes.py",
        "legacy_tool_id": "ffmpeg-errors",
        "legacy_title": "ffmpeg error: Stream specifier 'X' in filtergraph matches no streams"
      },
      "confidence": 0.9
    },
    {
      "entry_id": "ffmpeg-error-ffmpeg-error-encoder-codec-h264-not-found-for-output-stream",
      "kind": "error",
      "title": "ffmpeg error: Encoder (codec h264) not found for output stream",
      "statement": "Your ffmpeg build doesn't include libx264 (H.264 encoder). Often happens with `--disable-nonfree` builds. Fix: (1) check available encoders: `ffmpeg -encoders | grep 264`; (2) macOS Homebrew: `brew install ffmpeg` (includes libx264); (3) Linux: `apt install ffmpeg` (Ubuntu/Debian default includes libx264); (4) static build: download from `johnvansickle.com/ffmpeg/`; (5) hardware fallback: `-c:v h264_videotoolbox` (macOS) or `-c:v h264_nvenc` (NVIDIA GPU).",
      "source_url": "https://ffmpeg.org/ffmpeg-codecs.html",
      "source_type": "official_docs",
      "commands": [
        "--disable-nonfree",
        "ffmpeg -encoders | grep 264",
        "brew install ffmpeg",
        "apt install ffmpeg",
        "johnvansickle.com/ffmpeg/",
        "-c:v h264_videotoolbox",
        "-c:v h264_nvenc"
      ],
      "steps": [
        "check available encoders: `ffmpeg -encoders | grep 264`",
        "macOS Homebrew: `brew install ffmpeg` (includes libx264)",
        "Linux: `apt install ffmpeg` (Ubuntu/Debian default includes libx264)",
        "static build: download from `johnvansickle.com/ffmpeg/`",
        "hardware fallback: `-c:v h264_videotoolbox` (macOS) or `-c:v h264_nvenc` (NVIDIA GPU)"
      ],
      "constraints": [
        "check available encoders: `ffmpeg -encoders | grep 264`",
        "Requires binaries or commands referenced in examples: --disable-nonfree, -c:v, apt, brew, ffmpeg, johnvansickle.com/ffmpeg/."
      ],
      "effect": {
        "kind": "filesystem",
        "destructive": false,
        "reversible": true,
        "mutates_remote_state": false,
        "may_cost_money": false,
        "may_expose_secrets": false,
        "risk_level": "medium",
        "reasons": [
          "No explicit risk rule matched; require confirmation until the action is classified."
        ]
      },
      "provenance": {
        "source_artifact_id": "ffmpeg-curated-source-v1",
        "migration_method": "legacy_seed_projection_v1",
        "legacy_seed_script": "tools/scripts/seed_ffmpeg_errors_recipes.py",
        "legacy_tool_id": "ffmpeg-errors",
        "legacy_title": "ffmpeg error: Encoder (codec h264) not found for output stream"
      },
      "confidence": 0.9
    },
    {
      "entry_id": "ffmpeg-error-ffmpeg-error-unable-to-find-a-suitable-output-format",
      "kind": "error",
      "title": "ffmpeg error: Unable to find a suitable output format",
      "statement": "ffmpeg couldn't guess output format \u2014 your filename has no extension or unknown extension. Fix: (1) add proper extension: `out.mp4`, `out.mkv`, `out.mp3`; (2) force format explicitly: `-f mp4 out.bin`; (3) list available muxers: `ffmpeg -formats | grep -E '^.E'`; (4) for stream output: `-f hls`, `-f flv` (rtmp), `-f rtsp`.",
      "source_url": "https://ffmpeg.org/ffmpeg-formats.html",